{
  "$schema": "https://json-schema.org/draft/2020-12/schema",
  "$id": "passenger.schema.json",
  "type": "object",
  "additionalProperties": false,
  "required": ["id", "name", "role", "badge", "allowedFloors", "countMode", "verificationPaths"],
  "properties": {
    "id": { "type": "string", "minLength": 1 },
    "name": { "type": "string", "minLength": 1 },
    "role": { "enum": ["maintenance", "resident", "courier", "cleaner", "security"] },
    "badge": { "type": "string", "minLength": 1 },
    "allowedFloors": { "type": "array", "minItems": 1, "items": { "type": "string" }, "uniqueItems": true },
    "countMode": { "enum": ["normal", "ignore"] },
    "verificationPaths": { "type": "array", "minItems": 2, "items": { "type": "string" }, "uniqueItems": true }
  }
}
