[
  {
    "id": "worker_001",
    "name": "张伟",
    "role": "maintenance",
    "badge": "yellow",
    "allowedFloors": [
      "B2",
      "8"
    ],
    "countMode": "ignore",
    "verificationPaths": [
      "cam01",
      "protocol"
    ]
  },
  {
    "id": "resident_001",
    "name": "林岚",
    "role": "resident",
    "badge": "blue",
    "allowedFloors": [
      "3",
      "6",
      "9"
    ],
    "countMode": "normal",
    "verificationPaths": [
      "cam01",
      "registry"
    ]
  },
  {
    "id": "courier_001",
    "name": "陈杰",
    "role": "courier",
    "badge": "orange",
    "allowedFloors": [
      "1",
      "2",
      "3"
    ],
    "countMode": "normal",
    "verificationPaths": [
      "cam03",
      "registry"
    ]
  },
  {
    "id": "cleaner_001",
    "name": "赵梅",
    "role": "cleaner",
    "badge": "green",
    "allowedFloors": [
      "2",
      "4",
      "6",
      "8",
      "10",
      "12"
    ],
    "countMode": "normal",
    "verificationPaths": [
      "cam01",
      "protocol"
    ]
  },
  {
    "id": "security_001",
    "name": "周启",
    "role": "security",
    "badge": "white",
    "allowedFloors": [
      "B2",
      "1",
      "13"
    ],
    "countMode": "normal",
    "verificationPaths": [
      "cam01",
      "protocol"
    ]
  }
]
